title,series,authors,isbn,genres,description,pages,year,language,cover_image,total_number_ratings,average_rating,book_url
Kitchen,,"['Banana Yoshimoto', 'Megan Backus']",9780802142443,"['Fiction', 'Cultural', 'Japan', 'Asian Literature', 'Japanese Literature', 'Short Stories', 'Contemporary', 'Asia', 'Literature', 'Novels', 'Romance']","Banana Yoshimoto's novels have made her a sensation in Japan and all over the world, andKitchen, the dazzling English-language debut that is still her best-loved book, is an enchantingly original and deeply affecting book about mothers, love, tragedy, and the power of the kitchen and home in the lives of a pair of free-spirited young women in contemporary Japan. Mikage, the heroine ofKitchen, is an orphan raised by her grandmother, who has passed away. Grieving, she is taken in by her friend Yoichi and his mother (who was once his father), Eriko. As the three of them form an improvised family that soon weathers its own tragic losses, Yoshimoto spins a lovely, evocative tale that recalls early Marguerite Duras.Kitchenand its companion story, ""Moonlight Shadow,"" are elegant tales whose seeming simplicity is the ruse of a writer whose voice echoes in the mind and the soul.",160,1988,English,https://i.gr-assets.com/images/S/compressed.photo.goodreads.com/books/1327904393l/50144.jpg,"59,070",3.87,https://www.goodreads.com/book/show/21409704-sanctuary
Emily of New Moon,Emily #1,['L.M. Montgomery'],9780553233704,"['Classics', 'Fiction', 'Young Adult', 'Historical', 'Historical Fiction', 'Childrens', 'Cultural', 'Canada', 'Middle Grade', 'Romance', 'Coming Of Age']","Emily Starr never knew what it was to be lonely—until her beloved father died. Now Emily's an orphan, and her mother's snobbish relatives are taking her to live with them at New Moon Farm. She's sure she won't be happy. Emily deals with stiff, stern Aunt Elizabeth and her malicious classmates by holding her head high and using her quick wit. Things begin to change when she makes friends: with Teddy, who does marvelous drawings; with Perry, who's sailed all over the world with his father yet has never been to school; and above all, with Ilse, a tomboy with a blazing temper. Amazingly, Emily finds New Moon beautiful and fascinating. With new friends and adventures, Emily might someday think of herself as Emily of New Moon.",339,1923,English,https://i.gr-assets.com/images/S/compressed.photo.goodreads.com/books/1563899327l/3562._SY475_.jpg,"46,247",4.09,https://www.goodreads.com/book/show/21409704-sanctuary
Camino Island,Camino Island #1,['John Grisham'],9780385543026,"['Fiction', 'Mystery', 'Thriller', 'Audiobook', 'Crime', 'Mystery Thriller', 'Suspense', 'Writing', 'Books About Books', 'Adult', 'Adult Fiction']","A gang of thieves stage a daring heist from a vault deep below Princeton University's Firestone Library. Their loot is priceless, impossible to resist.Bruce Cable owns a popular bookstore in the sleepy resort town of Santa Rosa on Camino Island in Florida. He makes his real money, though, as a prominent dealer in rare books. Very few people know that he occasionally dabbles in unsavory ventures.Mercer Mann is a young novelist with a severe case of writer's block who has recently been laid off from her teaching position. She is approached by an elegant, mysterious woman working for an even more mysterious company. A generous monetary offer convinces Mercer to go undercover and infiltrate Cable's circle of literary friends, to get close to the ringleader, to discover his secrets.But soon Mercer learns far too much, and there's trouble in paradise--as only John Grisham can deliver it.",290,2017,English,https://i.gr-assets.com/images/S/compressed.photo.goodreads.com/books/1488922876l/34121119._SY475_.jpg,"114,604",3.76,https://www.goodreads.com/book/show/21409704-sanctuary
The Camp of the Saints,,"['Jean Raspail', 'Norman R. Shapiro']",9781881780076,"['Fiction', 'Politics', 'Literature', 'Science Fiction', 'Dystopia', 'Cultural', 'France', 'Race', 'Novels', 'Classics', 'Religion', 'Islam']","By the year 2000 there will on present projections be seven billion people swarming on the surface of the Earth. And only nine hundred million of them will be white. What will happen when the teeming billions of the so-called Third World - driven by unbearable hunger and despair, the inevitable consequences of insensate over-population - descend locust-like on the lush lands of the complacent white nations?Jean Raspail has the rare imagination and courage necessary to face this terrifying question head-on. Readers of whatever color and political persuasion will find in The Camp of the Saints (already a bestseller in France & America) a hypnotically readable novel of compelling power that will disturb, provoke and horrify them by turns. And so powerful is its impact that once you have read it you will need brain surgery to forget it.",316,1973,English,https://i.gr-assets.com/images/S/compressed.photo.goodreads.com/books/1451509595l/1181058._SY475_.jpg,"1,104",3.72,https://www.goodreads.com/book/show/21409704-sanctuary
Blue Bloods,Blue Bloods #1,['Melissa de la Cruz'],9780786838929,"['Young Adult', 'Paranormal', 'Vampires', 'Fantasy', 'Romance', 'Urban Fantasy', 'Supernatural', 'Fiction', 'Paranormal Romance', 'Angels']","When the Mayflower set sail in 1620, it carried on board the men and women who would shape America: Miles Standish; John Alden; Constance Hopkins. But some among the Pilgrims were not pure of heart; they were not escaping religious persecution. Indeed, they were not even human. They were vampires.The vampires assimilated quickly into the New World. Rising to levels of enormous power, wealth, and influence, they were the celebrated blue bloods of American society.TheBlue Bloodsvowed that their immortal status would remain a closely guarded secret. And they kept that secret for centuries. But now, in New York City, the secret is seeping out. Schuyler Van Alen is a sophomore at a prestigious private school. She prefers baggy, vintage clothes instead of the Prada and pearls worn by her classmates, and she lives with her reclusive grandmother in a dilapated mansion. Schuyler is a loner...and happy that way. Suddenly, when she turns fifteen, there is a visible mosaic of blue veins on her arm. She starts to crave raw food and she is having flashbacks to ancient times. Then a popular girl from her school is found dead... drained of all her blood. Schuyler doesn't know what to think, but she wants to find out the secrets the Blue Bloods are keeping. But is she herself in danger?",302,2006,English,https://i.gr-assets.com/images/S/compressed.photo.goodreads.com/books/1322281515l/872333.jpg,"141,507",3.69,https://www.goodreads.com/book/show/21409704-sanctuary
Gut gegen Nordwind,Gut gegen Nordwind  #1,['Daniel Glattauer'],9783552060418,"['Romance', 'Fiction', 'Contemporary', 'European Literature', 'German Literature', 'Womens Fiction', 'Chick Lit', 'Roman', 'Contemporary Romance', 'Novels', 'Adult', 'Audiobook']","Gibt es in einer vom Alltag besetzten Wirklichkeit einen besser geschützten Raum für gelebte Sehnsüchte als den virtuellen?Bei Leo Leike landen irrtümlich E-Mails einer ihm unbekannten Emmi Rothner. Aus Höflichkeit antwortet er ihr. Und weil sich Emmi von ihm angezogen fühlt, schreibt sie zurück.Bald gibt Leo zu: »Ich interessiere mich wahnsinnig für Sie, liebe Emmi! Ich weiß aber auch, wie absurd dieses Interesse ist.« Und wenig später gesteht Emmi: »Es sind Ihre Zeilen und meine Reime darauf: die ergeben so in etwa einen Mann, wie ich mir plötzlich vorstelle, dass es sein kann, dass es so jemanden wirklich gibt.«Es scheint nur noch eine Frage der Zeit zu sein, wann es zum ersten persönlichen Treffen kommt, aber diese Frage wühlt beide so sehr auf, dass sie die Antwort lieber noch eine Weile hinauszögern. Außerdem ist Emmi glücklich verheiratet. Und Leo verdaut gerade eine gescheiterte Beziehung.Und überhaupt: Werden die gesendeten, empfangenen und gespeicherten Liebesgefühle einer Begegnung standhalten? Und was, wenn ja?",223,2006,German,https://i.gr-assets.com/images/S/compressed.photo.goodreads.com/books/1188801960l/1820716._SY475_.jpg,"22,337",3.87,https://www.goodreads.com/book/show/21409704-sanctuary
The Future of Us,,"['Jay Asher', 'Carolyn Mackler']",9781595144911,"['Young Adult', 'Romance', 'Fiction', 'Contemporary', 'Science Fiction', 'Time Travel', 'Teen', 'Fantasy', 'Realistic Fiction', 'High School']","It's 1996, and Josh and Emma have been neighbors their whole lives. They've been best friends almost as long—at least, up until last November, when Josh did something that changed everything. Things have been weird between them ever since, but when Josh's family gets a free AOL CD in the mail, his mom makes him bring it over so that Emma can install it on her new computer. When they sign on, they're automatically logged onto their Facebook pages. But Facebook hasn't been invented yet. And they're looking at themselves fifteen years in the future.By refreshing their pages, they learn that making different decisions now will affect the outcome of their lives later. And as they grapple with the ups and downs of what their futures hold, they're forced to confront what they're doing right—and wrong—in the present.",356,2011,English,https://i.gr-assets.com/images/S/compressed.photo.goodreads.com/books/1366214559l/10959277.jpg,"48,831",3.58,https://www.goodreads.com/book/show/21409704-sanctuary
Firelight,Firelight #1,['Sophie Jordan'],9780061935084,"['Fantasy', 'Young Adult', 'Dragons', 'Romance', 'Paranormal', 'Paranormal Romance', 'Urban Fantasy', 'Supernatural', 'Shapeshifters', 'Magic']","A hidden truth.Mortal enemies.Doomed love.Marked as special at an early age, Jacinda knows her every move is watched. But she longs for freedom to make her own choices. When she breaks the most sacred tenet among her kind, she nearly pays with her life. Until a beautiful stranger saves her. A stranger who was sent to hunt those like her. For Jacinda is a draki, a descendant of dragons whose greatest defense is her secret ability to shift into human form.Forced to flee into the mortal world with her family, Jacinda struggles to adapt to her new surroundings. The only bright light is Will. Gorgeous, elusive Will who stirs her inner draki to life. Although she is irresistibly drawn to him, Jacinda knows Will's dark secret: He and his family are hunters. She should avoid him at all costs. But her inner draki is slowly slipping away;if it dies she will be left as a human forever. She'll do anything to prevent that. Even if it means getting closer to her most dangerous enemy.Mythical powers and breathtaking romance ignite in this story of a girl who defies all expectations and whose love crosses an ancient divide.",323,2010,English,https://i.gr-assets.com/images/S/compressed.photo.goodreads.com/books/1269737893l/6448470.jpg,"70,719",3.84,https://www.goodreads.com/book/show/21409704-sanctuary
The Snowman,Harry Hole #7,"['Jo Nesbø', 'Don Bartlett']",9780307595867,"['Mystery', 'Crime', 'Fiction', 'Thriller', 'Mystery Thriller', 'Suspense', 'European Literature', 'Scandinavian Literature', 'Detective', 'Scandinavian Lite...', 'Nordic Noir', 'Audiobook']","V Osle napadol prvý sneh. Jonas ráno vstane a zistí, že jeho matka zmizla. Ostane po nej jediná stopa – ružový šál, čo jej daroval na Vianoce. Má ho na krku snehuliak. Predošlú noc sa nečakane zjavil na dvore a jeho čierne oči hľadia priamo do domu.Prípad rieši inšpektor Harry Hole, ktorý nedávno dostal tajomný list s podpisom Snehuliak. Situácia sa ešte väčšmi zamotáva, keď Harry zistí, že tento model sa opakuje – za posledných desať rokov sa stratilo jedenásť žien, a to vždy presne v deň, keď napadol prvý sneh. Vyšetrovanie je pre Harryho o to zložitejšie, že sa týka jeho novej kolegyne, ale aj milovanej Rachel. Prípad Snehuliak ho privádza na pokraj šialenstva.Brilantne vykreslené postavy a gradujúce napätie sú zárukou napínavého príbehu, aký vie napísať len majster súčasných trilerov Jo Nesbo.",383,2007,English,https://i.gr-assets.com/images/S/compressed.photo.goodreads.com/books/1355881478l/9572203.jpg,"126,123",4.01,https://www.goodreads.com/book/show/21409704-sanctuary
Timon of Athens,,['William Shakespeare'],9780192814975,"['Plays', 'Classics', 'Drama', 'Fiction', 'Theatre', 'Poetry', 'Literature', 'European Literature', 'British Literature', '17th Century', 'Tragedy']",None,384,1605,English,https://i.gr-assets.com/images/S/compressed.photo.goodreads.com/books/1328033835l/104805.jpg,"7,054",3.42,https://www.goodreads.com/book/show/21409704-sanctuary
Miracle in the Andes,,"['Nando Parrado', 'Vince Rause']",1400097673,"['Nonfiction', 'Adventure', 'Survival', 'Biography', 'Autobiography', 'Memoir', 'History', 'Travel', 'Biography Memoir', 'True Story']","In the first hours there was nothing, no fear or sadness, just a black and perfect silence.Nando Parrado was unconscious for three days before he woke to discover that the plane carrying his rugby team, as well as their family members and supporters, to an exhibition game in Chile had crashed somewhere deep in the Andes. He soon learned that many were dead or dying—among them his own mother and sister. Those who remained were stranded on a lifeless glacier at nearly 12,000 feet above sea level, with no supplies and no means of summoning help. They struggled to endure freezing temperatures, deadly avalanches, and then the devastating news that the search for them had been called off.As time passed and Nando's thoughts turned increasingly to his father, who he knew must be consumed with grief, Nando resolved that he must get home or die trying. He would challenge the Andes, even though he was certain the effort would kill him, telling himself that even if he failed he would die that much closer to his father. It was a desperate decision, but it was also his only chance. So Nando, an ordinary young man with no disposition for leadership or heroism, led an expedition up the treacherous slopes of a snow-capped mountain and across forty-five miles of frozen wilderness in an attempt to find help.Thirty years after the disaster Nando tells his story with remarkable candor and depth of feeling.Miracle in the Andes—a first person account of the crash and its aftermath—is more than a riveting tale of true-life adventure: it is a revealing look at life at the edge of death and a meditation on the limitless redemptive power of love.",304,2006,English,https://i.gr-assets.com/images/S/compressed.photo.goodreads.com/books/1320544978l/454236.jpg,"17,292",4.28,https://www.goodreads.com/book/show/21409704-sanctuary
,None,None,,[],None,None,1983,,,,,https://www.goodreads.com/book/show/21409704-sanctuary
Dry,,['Augusten Burroughs'],9780312423797,"['Autobiography', 'Memoir', 'Nonfiction', 'Biography', 'Humor', 'Biography Memoir', 'LGBT', 'Audiobook', 'Psychology', 'Queer']","You may not know it, but you've met Augusten Burroughs. You've seen him on the street, in bars, on the subway, at restaurants: a twenty-something guy, nice suit, works in advertising. Regular. Ordinary. But when the ordinary person had two drinks, Augusten was circling the drain by having twelve; when the ordinary person went home at midnight, Augusten never went home at all. Loud, distracting ties, automated wake-up calls, and cologne on the tongue could only hide so much for so long. At the request (well, it wasn't really a request) of his employers, Augusten landed in rehab, where his dreams of group therapy with Robert Downey, Jr., are immediately dashed by the grim reality of fluorescent lighting and paper hospital slippers. But when Augusten is forced to examine himself, something actually starts to click, and that's when he finds himself in the worst trouble of all. Because when his thirty days are up, he has to return to his same drunken Manhattan life and live it sober. What follows is a memoir that's as moving as it is funny, as heartbreaking as it is real.",293,2003,English,https://i.gr-assets.com/images/S/compressed.photo.goodreads.com/books/1442601868l/32370.jpg,"96,327",3.97,https://www.goodreads.com/book/show/21409704-sanctuary
The Case for a Creator: A Journalist Investigates Scientific Evidence That Points Toward God,,['Lee Strobel'],9780310240501,"['Christian', 'Nonfiction', 'Religion', 'Science', 'Christianity', 'Theology', 'Faith', 'Christian Non Fiction', 'Philosophy', 'Spirituality']","A Journalist Investigates Scientific Evidence That Points Toward God: 'My road to atheism was paved by science . . . But, ironically, so was my later journey to God.' - Lee StrobelDuring his academic years, Lee Strobel became convinced that God was outmoded, a belief that colored his ensuing career as an award-winning journalist at the Chicago Tribune. Science had made the idea of a Creator irrelevant - or so Strobel thought. But today science is pointing in a different direction. In recent years, a diverse and impressive body of research has increasingly supported the conclusion that the universe was intelligently designed. At the same time, Darwinism has faltered in the face of concrete facts and hard reason.Has science discovered God? At the very least, it's giving faith an immense boost as new findings emerge about the incredible complexity of our universe. Join Strobel as he re-examines the theories that once led him away from God. Through his compelling and highly readable account, you'll encounter the mind-stretching discoveries from cosmology, cellular biology, DNA research, astronomy, physics, and human consciousness that present astonishing evidence in The Case for a Creator.",341,2004,English,https://i.gr-assets.com/images/S/compressed.photo.goodreads.com/books/1438312193l/214333._SY475_.jpg,"12,550",4.08,https://www.goodreads.com/book/show/21409704-sanctuary
The Queen of the Tearling,The Queen of the Tearling #1,['Erika Johansen'],9780062290380,"['Fantasy', 'Young Adult', 'Fiction', 'Science Fiction', 'Dystopia', 'Magic', 'Adult', 'Young Adult Fantasy', 'High Fantasy', 'Audiobook', 'Adventure']","Magic, adventure, mystery, and romance combine in this epic debut in which a young princess must reclaim her dead mother’s throne, learn to be a ruler—and defeat the Red Queen, a powerful and malevolent sorceress determined to destroy her.On her nineteenth birthday, Princess Kelsea Raleigh Glynn, raised in exile, sets out on a perilous journey back to the castle of her birth to ascend her rightful throne. Plain and serious, a girl who loves books and learning, Kelsea bears little resemblance to her mother, the vain and frivolous Queen Elyssa. But though she may be inexperienced and sheltered, Kelsea is not defenseless: Around her neck hangs the Tearling sapphire, a jewel of immense magical power; and accompanying her is the Queen’s Guard, a cadre of brave knights led by the enigmatic and dedicated Lazarus. Kelsea will need them all to survive a cabal of enemies who will use every weapon—from crimson-caped assassins to the darkest blood magic—to prevent her from wearing the crown.Despite her royal blood, Kelsea feels like nothing so much as an insecure girl, a child called upon to lead a people and a kingdom about which she knows almost nothing. But what she discovers in the capital will change everything, confronting her with horrors she never imagined. An act of singular daring will throw Kelsea’s kingdom into tumult, unleashing the vengeance of the tyrannical ruler of neighboring Mortmesne: the Red Queen, a sorceress possessed of the darkest magic. Now Kelsea will begin to discover whom among the servants, aristocracy, and her own guard she can trust.But the quest to save her kingdom and meet her destiny has only just begun—a wondrous journey of self-discovery and a trial by fire that will make her a legend . . . if she can survive.This book will be a beautifully designed package with illustrated endpapers, a map of the Tearling, and a ribbon marker.",448,2014,English,https://i.gr-assets.com/images/S/compressed.photo.goodreads.com/books/1461864815l/22864842.jpg,"90,998",3.98,https://www.goodreads.com/book/show/21409704-sanctuary
The Dice Man,Dice Man #1,['Luke Rhinehart'],9780879518646,"['Fiction', 'Psychology', 'Thriller', 'Novels', 'Classics', 'Contemporary', 'Philosophy', 'Literature', 'American', 'Humor']","The cult classic that can still change your life! Let the dice decide! This is the philosophy that changes the life of bored psychiatrist Luke Rhinehart -- and in some ways changes the world as well. Because once you hand over your life to the dice, anything can happen. Entertaining, humorous, scary, shocking, subversive, The Dice Man is one of the cult bestsellers of our time.",431,1971,English,https://i.gr-assets.com/images/S/compressed.photo.goodreads.com/books/1340739642l/828607.jpg,"18,576",3.56,https://www.goodreads.com/book/show/21409704-sanctuary
White Nights,,['Fyodor Dostoevsky'],8807901870,"['Classics', 'Fiction', 'Literature', 'Russian Literature', 'Cultural', 'Russia', 'Short Stories', 'Romance', 'Novels', '19th Century', 'Novella']","White Nights is a short story by Fyodor Dostoevsky that was published in 1848. Set in St. Petersburg, it is the story of a young man fighting his inner restlessness. A light and tender narrative, it delves into the torment and guilt of unrequited love. Both protagonists suffer from a deep sense of alienation that initially brings them together. A blend of romanticism and realism, the story appeals gently to the senses and feelings.",82,1848,English,https://i.gr-assets.com/images/S/compressed.photo.goodreads.com/books/1450699039l/1772910.jpg,"67,114",4.01,https://www.goodreads.com/book/show/21409704-sanctuary
Beautiful Ruins,,['Jess Walter'],9780061928123,"['Fiction', 'Historical', 'Historical Fiction', 'Cultural', 'Italy', 'Romance', 'Audiobook', 'Contemporary', 'Book Club', 'Adult Fiction', 'Adult']","The story begins in 1962. On a rocky patch of the sun-drenched Italian coastline, a young innkeeper, chest-deep in daydreams, looks out over the incandescent waters of the Ligurian Sea and spies an apparition: a tall, thin woman, a vision in white, approaching him on a boat. She is an actress, he soon learns, an American starlet, and she is dying.And the story begins again today, half a world away, when an elderly Italian man shows up on a movie studio's back lot—searching for the mysterious woman he last saw at his hotel decades earlier.What unfolds is a dazzling, yet deeply human, roller coaster of a novel, spanning fifty years and nearly as many lives. From the lavish set ofCleopatrato the shabby revelry of the Edinburgh Fringe Festival, Walter introduces us to the tangled lives of a dozen unforgettable characters: the starstruck Italian innkeeper and his long-lost love; the heroically preserved producer who once brought them together and his idealistic young assistant; the army veteran turned fledgling novelist and the rakish Richard Burton himself, whose appetites set the whole story in motion—along with the husbands and wives, lovers and dreamers, superstars and losers, who populate their world in the decades that follow.Gloriously inventive, constantly surprising,Beautiful Ruinsis a story of flawed yet fascinating people, navigating the rocky shores of their lives while clinging to their improbable dreams.",337,2012,English,https://i.gr-assets.com/images/S/compressed.photo.goodreads.com/books/1338161553l/11447921.jpg,"167,622",3.67,https://www.goodreads.com/book/show/21409704-sanctuary
Stiff: The Curious Lives of Human Cadavers,,['Mary Roach'],9780393324822,"['Nonfiction', 'Science', 'Humor', 'Medical', 'Health', 'Medicine', 'Audiobook', 'Death', 'History', 'Adult', 'Biology']","Stiffis an oddly compelling, often hilarious exploration of the strange lives of our bodies postmortem. For two thousand years, cadavers—some willingly, some unwittingly—have been involved in science's boldest strides and weirdest undertakings. In this fascinating account, Mary Roach visits the good deeds of cadavers over the centuries and tells the engrossing story of our bodies when we are no longer with them.",303,2003,English,https://i.gr-assets.com/images/S/compressed.photo.goodreads.com/books/1347656489l/32145.jpg,"192,673",4.04,https://www.goodreads.com/book/show/21409704-sanctuary
Freak the Mighty,Freak The Mighty #1,['Rodman Philbrick'],9780439286060,"['Young Adult', 'Realistic Fiction', 'Fiction', 'Childrens', 'Middle Grade', 'Academic', 'School', 'Read For School', 'Contemporary', 'Coming Of Age', 'Classics']",,192,1993,English,https://i.gr-assets.com/images/S/compressed.photo.goodreads.com/books/1440388999l/8953._SX318_.jpg,"47,188",4.02,https://www.goodreads.com/book/show/21409704-sanctuary
