title,series,authors,isbn,genres,description,pages,year,language,cover_image,total_number_ratings,average_rating,book_url
Birdman,Jack Caffery #1,['Mo Hayder'],9780440236160,"['Mystery', 'Thriller', 'Crime', 'Fiction', 'Horror', 'Mystery Thriller', 'Suspense', 'Audiobook', 'Detective', 'Novels']","Greenwich, south-east London. The Met's crack murder squad, AMIP, is called out by nervous CID detectives to a grim discovery. Five bodies, all young women, all ritualistically murdered and dumped on wasteland near the Dome. As each post-mortem reveals a singular, horrific signature linking the victims, officers realize that they are on the trail of that most dangerous offender: a sexual serial killer.Detective Inspector Jack Caffery - young, driven, unshockable - finds himself facing both hostility within the force and echoes of his past in this, his first case with AMIP. Haunted by the memory of a death long ago, he employs every weapon forensic science can offer for he knows it is only a matter of time before this chaotic, sadistic killer strikes again.",448,1999,English,https://i.gr-assets.com/images/S/compressed.photo.goodreads.com/books/1388725583l/130260.jpg,"24,355",3.9,https://www.goodreads.com/book/show/21409704-sanctuary
The Third Twin,,['Ken Follett'],8804442476,"['Fiction', 'Thriller', 'Mystery', 'Suspense', 'Crime', 'Science Fiction', 'Mystery Thriller', 'Novels', 'Contemporary', 'Historical', 'Historical Fiction']","Using a restricted FBI database, genetic researcher Jeanie Ferrami has located identical twinsborn to different mothers. Frightened by her bizarre discovery, she is determined to discover the truth at any cost—until she finds herself at the center of a scandal that could ruin her career. To fight the charges, Jeannie plunges into a maze of hidden evidence. With growing horror, she uncovers a cynical, far-reaching conspiracy involving disturbing genetic experiments and some of the most powerful men in America—men who will kill to keep their secrets concealed.",640,1996,English,https://i.gr-assets.com/images/S/compressed.photo.goodreads.com/books/1348833324l/92373.jpg,"31,157",3.76,https://www.goodreads.com/book/show/21409704-sanctuary
Cursor's Fury,Codex Alera #3,['Jim Butcher'],9780441014347,"['Fantasy', 'Fiction', 'Epic Fantasy', 'High Fantasy', 'Young Adult', 'Adventure', 'Magic', 'Childrens', 'Science Fiction Fantasy', 'Audiobook']","The power-hungry High Lord of Kalare has launched a rebellion against the aging First Lord, Gaius Sextus, who with the loyal forces of Alera must fight beside the unlikeliest of allies-the equally contentious High Lord of Aquitaine.Meanwhile, young Tavi of Calderon joins a newly formed legion under an assumed name even as the ruthless Kalare unites with the Canim, bestial enemies of the realm whose vast numbers spell certain doom for Alera.When treachery from within destroys the army's command structure, Tavi finds himself leading an inexperienced, poorly equipped legion-the only force standing between the Canim horde and the war-torn realm.",442,2006,English,https://i.gr-assets.com/images/S/compressed.photo.goodreads.com/books/1388360145l/29394.jpg,"66,633",4.31,https://www.goodreads.com/book/show/21409704-sanctuary
The Diviners,The Diviners #1,['Libba Bray'],0316126101,"['Fantasy', 'Young Adult', 'Historical', 'Historical Fiction', 'Paranormal', 'Mystery', 'Horror', 'Fiction', 'Audiobook', 'Supernatural']","SOMETHING DARK AND EVIL HAS AWAKENED… Evie O’Neill has been exiled from her boring old hometown and shipped off to the bustling streets of New York City—and she is pos-i-tute-ly ecstatic. It’s 1926, and New York is filled with speakeasies, Ziegfeld girls, and rakish pickpockets. The only catch is that she has to live with her uncle Will and his unhealthy obsession with the occult. Evie worries her uncle will discover her darkest secret: a supernatural power that has only brought her trouble so far. But when the police find a murdered girl branded with a cryptic symbol and Will is called to the scene, Evie realizes her gift could help catch a serial killer. As Evie jumps headlong into a dance with a murderer, other stories unfold in the city that never sleeps. A young man named Memphis is caught between two worlds. A chorus girl named Theta is running from her past. A student named Jericho is hiding a shocking secret. And unknown to all, something dark and evil has awakened…",578,2012,English,https://i.gr-assets.com/images/S/compressed.photo.goodreads.com/books/1555345561l/7728889._SY475_.jpg,"99,566",3.92,https://www.goodreads.com/book/show/21409704-sanctuary
61 Hours,Jack Reacher #14,['Lee Child'],9780385340588,"['Thriller', 'Fiction', 'Mystery', 'Crime', 'Suspense', 'Action', 'Mystery Thriller', 'Audiobook', 'Adventure', 'War', 'Military Fiction']","Jack Reacher is back.The countdown has begun. Get ready for the most exciting 61 hours of your life. #1 ""New York Times"" bestselling author Lee Child's latest thriller is a ticking time bomb of suspense that builds electric tension on every page.Sixty-one hours. Not a minute to spare.A tour bus crashes in a savage snowstorm and lands Jack Reacher in the middle of a deadly confrontation. In nearby Bolton, South Dakota, one brave woman is standing up for justice in a small town threatened by sinister forces. If she's going to live long enough to testify, she'll need help. Because a killer is coming to Bolton, a coldly proficient assassin who never misses.Reacher's original plan was to keep on moving. But the next 61 hours will change everything. The secrets are deadlier and his enemies are stronger than he could have guessed--but so is the woman whose life he'll risk his own to save.In 61 Hours, Lee Child has written a showdown thriller with an explosive ending that readers will talk about for a long time to come.",383,2010,English,https://i.gr-assets.com/images/S/compressed.photo.goodreads.com/books/1320512665l/6977769.jpg,"81,376",4.1,https://www.goodreads.com/book/show/21409704-sanctuary
2nd Chance,Women's Murder Club #2,"['James Patterson', 'Andrew Gross']",9780446696630,"['Mystery', 'Fiction', 'Crime', 'Thriller', 'Mystery Thriller', 'Suspense', 'Murder Mystery', 'Audiobook', 'Detective', 'Adult']","The Women's Murder Club returns for another thrilling crime investigation. Will their skills be enough to take down a brutal madman?A brutal madman sprays bullets into a crowd of children leaving a San Francisco church. Miraculously-or was it intentionally?-only one person dies. Then an elderly black woman is hung. Police homicide inspector Lindsay Boxer senses a connection and together with medical examiner Claire, assistant D. A. Jill, and Chronicle reporter Cindy, finds a link that sends a chill through the entire nation. This killer's motives are unspeakable.In this ""inventive"" installment of the Women's Murder Club, James Patterson proves once again why he is the #1 master of the murder mystery (Sunday Times).",400,2002,English,https://i.gr-assets.com/images/S/compressed.photo.goodreads.com/books/1522906622l/13136._SY475_.jpg,"103,832",4.05,https://www.goodreads.com/book/show/21409704-sanctuary
Red Sparrow,Red Sparrow Trilogy #1,['Jason  Matthews'],9781476706122,"['Fiction', 'Thriller', 'Mystery', 'Spy Thriller', 'Espionage', 'Mystery Thriller', 'Audiobook', 'Cultural', 'Russia', 'Suspense', 'Crime']","In the grand spy-tale tradition of John le Carré comes this shocking thriller written with insider detail known only to a veteran CIA officer.In present-day Russia, ruled by blue-eyed, unblinking President Vladimir Putin, Russian intelligence officer Dominika Egorova struggles to survive in the post-Soviet intelligence jungle. Ordered against her will to become a “Sparrow,” a trained seductress, Dominika is assigned to operate against Nathaniel Nash, a young CIA officer who handles the Agency’s most important Russian mole.Spies have long relied on the “honey trap,” whereby vulnerable men and women are intimately compromised. Dominika learns these techniques of “sexpionage” in Russia’s secret “Sparrow School,” hidden outside of Moscow. As the action careens between Russia, Finland, Greece, Italy, and the United States, Dominika and Nate soon collide in a duel of wills, tradecraft, and—inevitably—forbidden passion that threatens not just their lives but those of others as well. As secret allegiances are made and broken, Dominika and Nate’s game reaches a deadly crossroads. Soon one of them begins a dangerous double existence in a life-and-death operation that consumes intelligence agencies from Moscow to Washington, DC.Page by page, veteran CIA officer Jason Matthews’sRed Sparrowdelights and terrifies and fascinates, all while delivering an unforgettable cast, from a sadistic Spetsnaz “mechanic” who carries out Putin’s murderous schemes to the weary CIA Station Chief who resists Washington “cake-eaters” to MARBLE, the priceless Russian mole. Packed with insider detail and written with brio, this tour-de-force novel brims with Matthews’s life experience, including his knowledge of espionage, counterintelligence, surveillance tradecraft, spy recruitment, cyber-warfare, the Russian use of “spy dust,” and covert communications. Brilliantly composed and elegantly constructed,Red Sparrowis a masterful spy tale lifted from the dossiers of intelligence agencies on both sides of the Atlantic. Authentic, tense, and entertaining, this novel introduces Jason Matthews as a major new American talent.",434,2013,English,https://i.gr-assets.com/images/S/compressed.photo.goodreads.com/books/1361806944l/15803037.jpg,"51,488",3.95,https://www.goodreads.com/book/show/21409704-sanctuary
The Cloister Walk,,['Kathleen Norris'],9781573225847,"['Nonfiction', 'Autobiography', 'Memoir', 'Spirituality', 'Religion', 'Faith', 'Christianity', 'Theology', 'Christian', 'Biography', 'Biography Memoir']","Why would a married woman with a thoroughly Protestant background and often more doubt than faith be drawn to the ancient practice of monasticism, to a community of celibate men whose days are centered around a rigid schedule of prayer, work, and scripture? This is the question that poet Kathleen Norris asks us as, somewhat to her own surprise, she found herself on two extended residencies at St. John's Abbey in Minnesota. Part record of her time among the Benedictines, part meditation on various aspects of monastic life,The Cloister Walkdemonstrates, from the rare perspective of someone who is both an insider and outsider, how immersion in the cloistered world -- its liturgy, its ritual, its sense of community -- can impart meaning to everyday events and deepen our secular lives. In this stirring and lyrical work, the monastery, often considered archaic or otherworldly, becomes immediate, accessible, and relevant to us, no matter what our faith may be.* A New York Times bestseller for 23 weeks* A New York Times Notable Book of the Year",385,1996,English,https://i.gr-assets.com/images/S/compressed.photo.goodreads.com/books/1394411228l/108681.jpg,"9,532",3.98,https://www.goodreads.com/book/show/21409704-sanctuary
"Adversity Builds Character; An Inspirational True Life Story of Disability, Addiction and Acceptance",,['Tom Ufert'],B009NN5RJY,[],"Adversity builds character is the story of a young man's life struggles to find his way through the trials and tribulations, family turmoil, self-determination and personal judgment.This transformational life experience, like so many, demonstrates the triumph of the human spirit over the pitfalls in our modern world. From a divorce wrecked family life brought on by that by a disease ridden single mom, he is blessed with the first of many second chances. His godmother and her family, which becomes his stepparents, cause him to overcome personal character flaws. This new home life radically averts potential disaster and leads him to greater heights by redirecting the God-given talents of his character leading to never before realized academic and social achievements. At the height of his newfound career, his world is shattered yet again by the sudden tragic loss of his mother in a bizarre event of a mercy killing and suicide. While attempting to put this catastrophe behind him, drinking and sexual experimentation almost ruin his future hopes of a promising political career. He decides to study abroad and finds the first real love of his life. Yet short-lived and having to return, divorce of his stepparents again forces a change of direction, ultimately pointing the way to his true self. While postponing his career, he relocates and discovers a world where he finally feels at home and accepted without ridicule. As is so often the case where comfort and overconfidence leads to weakness and self-destruction, it is at this moment that one either succumbs to the burden of outside influence or gathers up all his strength to rise above like a phoenix.",0,2011,English,https://i.gr-assets.com/images/S/compressed.photo.goodreads.com/books/1349813166l/16076228.jpg,37,4.76,https://www.goodreads.com/book/show/21409704-sanctuary
Poison Study,Poison Study #1,['Maria V. Snyder'],9780778324331,"['Fantasy', 'Young Adult', 'Romance', 'Magic', 'Fiction', 'Paranormal', 'High Fantasy', 'Young Adult Fantasy', 'Adventure', 'New Adult']","Choose: A quick death… or slow poison...About to be executed for murder, Yelena is offered an extraordinary reprieve. She'll eat the best meals, have rooms in the palace—and risk assassination by anyone trying to kill the Commander of Ixia.And so Yelena chooses to become a food taster. But the chief of security, leaving nothing to chance, deliberately feeds her Butterfly's Dust—and only by appearing for her daily antidote will she delay an agonizing death from the poison.As Yelena tries to escape her new dilemma, disasters keep mounting. Rebels plot to seize Ixia and Yelena develops magical powers she can't control. Her life is threatened again and choices must be made. But this time the outcomes aren't so clear...",427,2005,English,https://i.gr-assets.com/images/S/compressed.photo.goodreads.com/books/1388519019l/60510.jpg,"163,774",4.07,https://www.goodreads.com/book/show/21409704-sanctuary
Broken for You,,['Stephanie Kallos'],9780802142108,"['Fiction', 'Book Club', 'Contemporary', 'Adult Fiction', 'World War II', 'Holocaust', 'Womens Fiction', 'Chick Lit', 'Literary Fiction', 'Adult', 'Audiobook', 'Relationships']","National best seller andTodayshow Book Club selection,Broken for Youis the story of two women in self-imposed exile whose lives are transformed when their paths intersect. Stephanie Kallos's debut novel is a work of infinite charm, wit and heart. It is also a glorious homage to the beauty of broken things.When we meet septuagenarian Margaret Hughes, she is living alone in a mansion in Seattle with only a massive collection of valuable antiques for company. Enter Wanda Schultz, a young woman with a broken heart who has come west to search for her wayward boyfriend. Both women are guarding dark secrets and have spent many years building up protective armor against the outside world. As their tentative friendship evolves, the armor begins to fall away and Margaret opens her house to the younger woman. This launches a series of unanticipated events, leading Margaret to discover a way to redeem her cursed past, and Wanda to learn the true purpose of her cross-country journey.Both funny and heartbreaking,Broken for Youis a testament to the saving graces of surrogate families and shows how far the tiniest repair jobs can go in righting the world's wrongs.",373,2004,English,https://i.gr-assets.com/images/S/compressed.photo.goodreads.com/books/1442278943l/96702._SX318_.jpg,"12,400",3.82,https://www.goodreads.com/book/show/21409704-sanctuary
100 Selected Poems,,['E.E. Cummings'],9780802130723,"['Poetry', 'Classics', 'Literature', 'American', 'Fiction', '20th Century', 'The United States Of America', 'Anthologies', 'Collections', 'Poetry Plays']","E.E. Cummings is without question one of the major poets of the 20th century, and this volume, first published in 1959, is indispensable for every lover of modern lyrical verse. It contains one hundred of Cummings’s wittiest and most profound poems, harvested from thirty-five of the most radically creative years in contemporary American poetry. These poems exhibit all the extraordinary lyricism, playfulness, technical ingenuity, and compassion for which Cummings is famous. They demonstrate beautifully his extrapolations from traditional poetic structures and his departures from them, as well as the unique synthesis of lavish imagery and acute artistic precision that has won him the adulation and respect of critics and poetry lovers everywhere.",121,1954,English,https://i.gr-assets.com/images/S/compressed.photo.goodreads.com/books/1388179993l/76889.jpg,"27,572",4.29,https://www.goodreads.com/book/show/21409704-sanctuary
The Melancholy Death of Oyster Boy and Other Stories,,['Tim Burton'],9780688156817,"['Poetry', 'Fiction', 'Short Stories', 'Fantasy', 'Humor', 'Horror', 'Art', 'Sequential Art', 'Graphic Novels', 'Gothic', 'Young Adult']","From breathtaking stop-action animation to bittersweet modern fairy tales, filmmakerTim Burtonhas become known for his unique visual brilliance – witty and macabre at once. Now he gives birth to a cast of gruesomely sympathetic children – misunderstood outcasts who struggle to find love and belonging in their cruel, cruel worlds. His lovingly lurid illustrations evoke both the sweetness and the tragedy of these dark yet simple beings – hopeful, hapless heroes who appeal to the ugly outsider in all of us, and let us laugh at a world we have long left behind (mostly anyway).",115,1997,English,https://i.gr-assets.com/images/S/compressed.photo.goodreads.com/books/1338646527l/519112.jpg,"35,288",4.12,https://www.goodreads.com/book/show/21409704-sanctuary
Season of Migration to the North,,"['Tayeb Salih', 'Denys Johnson-Davies', 'الطيب صالح']",9780435900663,"['Fiction', 'Cultural', 'Africa', 'Novels', 'Classics', 'Northern Africa', 'Sudan', 'Literature', 'African Literature', 'Historical', 'Historical Fiction', '20th Century', 'Academic', 'School']","After years of study in Europe, the young narrator of Season of Migration to the North returns to his village along the Nile in the Sudan. It is the 1960s, and he is eager to make a contribution to the new postcolonial life of his country. Back home, he discovers a stranger among the familiar faces of childhood—the enigmatic Mustafa Sa’eed. Mustafa takes the young man into his confidence, telling him the story of his own years in London, of his brilliant career as an economist, and of the series of fraught and deadly relationships with European women that led to a terrible public reckoning and his return to his native land.But what is the meaning of Mustafa’s shocking confession? Mustafa disappears without explanation, leaving the young man—whom he has asked to look after his wife—in an unsettled and violent no-man’s-land between Europe and Africa, tradition and innovation, holiness and defilement, and man and woman, from which no one will escape unaltered or unharmed.Season of Migration to the North is a rich and sensual work of deep honesty and incandescent lyricism. In 2001 it was selected by a panel of Arab writers and critics as the most important Arab novel of the twentieth century.",176,1966,English,https://i.gr-assets.com/images/S/compressed.photo.goodreads.com/books/1387663113l/669780.jpg,"22,878",3.71,https://www.goodreads.com/book/show/21409704-sanctuary
Bounty from the Box: The CSA Farm Cookbook,,['Mi Ae Lipe'],9780990501107,"['Food and Drink', 'Cookbooks', 'Cooking', 'Culinary', 'New Adult', 'Adult']",,712,2015,,https://i.gr-assets.com/images/S/compressed.photo.goodreads.com/books/1465428510l/27287136.jpg,122,4.38,https://www.goodreads.com/book/show/21409704-sanctuary
Think of a Number,Dave Gurney #1,['John Verdon'],9780307588920,"['Mystery', 'Thriller', 'Fiction', 'Crime', 'Mystery Thriller', 'Suspense', 'Detective', 'Contemporary', 'Adult', 'Audiobook']","An extraordinary fiction debut,Think of a Numberis an exquisitely plotted novel of suspense that grows relentlessly darker and more frightening as its pace accelerates, forcing its deeply troubled characters to moments of startling self-revelation.Arriving in the mail over a period of weeks are taunting letters that end with a simple declaration, “Think of any number…picture it…now see how well I know your secrets.” Amazingly, those who comply find that the letter writer has predicted their random choice exactly. For Dave Gurney, just retired as the NYPD’s top homicide investigator and forging a new life with his wife, Madeleine, in upstate New York, the letters are oddities that begin as a diverting puzzle but quickly ignite a massive serial murder investigation.What police are confronted with is a completely baffling killer, one who is fond of rhymes filled with threats and warnings, whose attention to detail is unprecedented, and who has an uncanny knack for disappearing into thin air. Even more disturbing, the scale of his ambition seems to widen as events unfold.Brought in as an investigative consultant, Dave Gurney soon accomplishes deductive breakthroughs that leave local police in awe. Yet, even as he matches wits with his seemingly clairvoyant opponent, Gurney’s tragedy-marred past rises up to haunt him, his marriage approaches a dangerous precipice, and finally, a dark, cold fear builds that he’s met an adversary who can’t be stopped.In the end, fighting to keep his bearings amid a whirlwind of menace and destruction, Gurney sees the truth of what he’s become – what we all become when guilty memories fester – and how his wife Madeleine’s clear-eyed advice may be the only answer that makes sense.A work that defies easy labels -- at once a propulsive masterpiece of suspense and an absorbing immersion in the lives of characters so real we seem to hear their heartbeats –Think of a Numberis a novel you’ll not soon forget.",418,2010,English,https://i.gr-assets.com/images/S/compressed.photo.goodreads.com/books/1394236041l/7853137.jpg,"31,381",3.87,https://www.goodreads.com/book/show/21409704-sanctuary
The Gate to Women's Country,,['Sheri S. Tepper'],9780006482703,"['Science Fiction', 'Fiction', 'Fantasy', 'Dystopia', 'Feminism', 'Apocalyptic', 'Post Apocalyptic', 'Speculative Fiction', 'Science Fiction Fantasy', 'Gender', 'Womens']","Tepper's finest novel to date is set in a post-holocaust feminist dystopia that offers only two political alternatives: a repressive polygamist sect that is slowly self-destructing through inbreeding and the matriarchal dictatorship called Women's Country. Here, in a desperate effort to prevent another world war, the women have segregated most men into closed military garrisons and have taken on themselves every other function of government, industry, agriculture, science and learning.The resulting manifold responsibilities are seen through the life of Stavia, from a dreaming 10-year-old to maturity as doctor, mother and member of the Marthatown Women's Council. As in Tepper's Awakeners series books, the rigid social systems are tempered by the voices of individual experience and, here, by an imaginative reworking of The Trojan Woman that runs through the text. A rewarding and challenging novel that is to be valued for its provocative ideas.",315,1987,English,https://i.gr-assets.com/images/S/compressed.photo.goodreads.com/books/1171511056l/104344.jpg,"12,638",4.06,https://www.goodreads.com/book/show/21409704-sanctuary
"The Sea, The Sea",,"['Iris Murdoch', 'Mary Kinzie']",9780141186160,"['Fiction', 'Classics', 'Novels', 'Literature', 'Literary Fiction', 'European Literature', 'British Literature', '20th Century', 'Philosophy', 'Irish Literature', 'Modern Classics']","Charles Arrowby, leading light of England's theatrical set, retires from glittering London to an isolated home by the sea. He plans to write a memoir about his great love affair with Clement Makin, his mentor both professionally and personally, and to amuse himself with Lizzie, an actress he has strung along for many years. None of his plans work out, and his memoir evolves into a riveting chronicle of the strange events and unexpected visitors--some real, some spectral--that disrupt his world and shake his oversized ego to its very core.In exposing the jumble of motivations that drive Arrowby and the other characters, Iris Murdoch lays bare ""the truth of untruth""--the human vanity, jealousy, and lack of compassion behind the disguises they present to the world. Played out against a vividly rendered landscape and filled with allusions to myth and magic, Charles's confrontation with the tidal rips of love and forgiveness is one of Murdoch's most moving and powerful novels.",528,1978,English,https://i.gr-assets.com/images/S/compressed.photo.goodreads.com/books/1302898449l/11229.jpg,"17,733",3.93,https://www.goodreads.com/book/show/21409704-sanctuary
