title,series,authors,isbn,genres,description,pages,year,language,cover_image,total_number_ratings,average_rating,book_url
"The Alpha and the Omega: An absurd philosophical tale about God, the end of the world, and what's on the other planets",,['H.M. Charley Ada'],9781496033079,"['Fantasy', 'Fiction', 'Philosophy', 'Novels']","Monday, March 28, 2016 begins like any other day for Zack, a devout atheist with a profitable appointment as an equity fund manager at a top Wall Street firm. He squeezes into the last seat on the subway car and does not say anything to the man sitting next to him selfishly hogging all the space. He grabs a coffee at his favorite newsstand and heads to his office. And later, his eyes wander to the photo of his dead parents on the corner of his desk.However, a few minutes after the closing bell, a most unusual thing happens. The true and living God of Heaven and Earth walks into Zack’s office and declares that he is real, that he is ending the world and turning Earth into the new Heaven, and that Zack may stay, despite his atheism, because he was a good person.Once Zack gets his bearings in the stunning dreamscape that is God’s new kingdom on Earth, God introduces him to Lilly, a headstrong former-lawyer for the poor who also once worshipped at the church of the faithless. Together, they explore paradise’s many wonders large and small, such as telepathy, the cloud cities, and never needing to use a bathroom. In this, they find a measure of happiness. However, not everything is as it seems, as it may turn out that God has a reason for not revealing what he keeps on the other planets … and there just might be more than one deity in the universe.The Alpha and the Omega is a satiric, post-apocalyptic love story. It’s an absurdist philosophical novel. It’s a sci-fi/action, Hollywood-blockbuster waiting to be made. And it will answer all of your deepest questions about the meaning of life and will reveal all of the universe’s wildest, most incredible secrets. I promise.WARNING: THIS PRODUCT CONTAINS PROFANITY; POLITICAL OPINION; LONG, PHILOSOPHICAL-ISH DIALOGUE; AND OTHER OFFENSIVE MATERIAL NOT SUITABLE FOR MOST READERS. ALL CHARACTERS AND EVENTS ARE PURELY FICTIONAL, AND ANY RESEMBLANCES TO YOUR GOD OR OTHER GODS YOU MAY BE FAMILIAR WITH ARE PURELY COINCIDENTAL. ALSO, PRODUCT MAY NOT ACTUALLY REVEAL THE MEANING OF LIFE OR THE UNIVERSE’S WILDEST, MOST INCREDIBLE SECRETS. INDIVIDUAL RESULTS WILL VARY.",304,2014,English,https://i.gr-assets.com/images/S/compressed.photo.goodreads.com/books/1405164645l/22712011.jpg,103,3.72,https://www.goodreads.com/book/show/21409704-sanctuary
Seven Wakings,,['S.K. McCauley'],9781499567571,['Fantasy'],"After Emma James— a widowed mother and child protection agent— is murdered to cover up a kidnapping ring, she reincarnates to solve the crimes.With SEVEN WAKINGS, Emma finds herself as: a homeless African American man, a sex-crazed lady of means, a morbidly obese Caucasian woman, a dashing lawyer with a hidden agenda, an innocent girl in shackles, a ruthless double-life cop, and an aging billionaire with alifetime of secrets.But, challenging incarnations are nothing compared to navigating the dark world of crooked cops, pedophile cults, and murderous plots— with only the help of her best friend, two kids and a rookie cop. Are things as they appear, or could there be help that even the resurrected can’t see?",214,2014,English,https://i.gr-assets.com/images/S/compressed.photo.goodreads.com/books/1416356186l/22354029.jpg,"3,422",3.9,https://www.goodreads.com/book/show/21409704-sanctuary
Politixworks,,['Chuck U. Farlie'],0990993906,[],"Politixworks is a satirical examination of the fecklessness of leadership in a modern democracy. In it there are allusions to the two normative ideologies, liberalism and conservatism, wrestling with each other through the personifications of Lyndon Johnson and Theodore Cruz. Struggling to win the hearts and minds of a community of 12 year old children, the two rivals are like ""old ghosts batting for the soul of their class"". Both aspire to lead the 6th grade to their own ends which requires that they transform into political leaders. They are craven, crass, brutish, impulsive and reckless, and in all ways that matter, reflect the accurate caricature of the modern politician.",228,2014,English,https://i.gr-assets.com/images/S/compressed.photo.goodreads.com/books/1417768045l/23681340.jpg,14,4.71,https://www.goodreads.com/book/show/21409704-sanctuary
,None,None,,[],None,None,2015,,,,,https://www.goodreads.com/book/show/21409704-sanctuary
THE COALFIELD EXPRESS,,['Susmit Sarkar'],9781482841985,[],"This book is about a mystery in the arena of Love. It starts off in a flashback when Susmit, an Electrical Engineer trips over Sheena, a student of Archeology. And the place circumscribes the compartment of a train named THE COALFIELD EXPRESS, with departure time of 5:20 pm at Howrah Station and expected arrival time of 7:30 pm at Durgapur. The novel sparks up with Love but ends with a mystery.Things in the compartment starts to get a bit rocky, when the combo of Susmit and Sheena meet a series of disasters.Crossing a lot of hurdles, their feet succeeded in laying them to their destination, in short, their home. The time was 2:00 am. Before the next 24 hours can pass they are separated. The flashback ends when after two years Susmit stumbles over again in the Coalfield Express, but this time with an old man. But a lot had happened in the last two years. No, its not that Sheena had fallen in love with any other geek. Its even more serious. Sheena had fallen into trouble. . A trouble that started with an excursion through the sands of Rajashthan, where she finds a cryptex, which got lost even before she could blink her eye. Are they able to crack it? Or Mr. Roy, a villain gets it before their game even begins? That's the question. I hope you enjoy the trip...",104,2014,English,https://i.gr-assets.com/images/S/compressed.photo.goodreads.com/books/1464018196l/23783904._SY475_.jpg,7,4.86,https://www.goodreads.com/book/show/21409704-sanctuary
The Kafir Project,,['Lee Burvine'],9781530651351,"['Fiction', 'Science Fiction', 'Religion', 'Audiobook', 'Mystery', 'Atheism']","Astronomer and TV science guy Gevin Rees just landed the interview of a lifetime with the world's most famous physicist. Remarkable, because the eccentric genius is notoriously reclusive.And he's already dead.What happens next forces Rees to run for his life from two separate assassins and global powers desperate to bury what he's just uncovered. Mind-blowing technology and solid evidence that would rewrite religious history and challenge the faith of billions.Rees teams up with DCIS Special Agent Kerry Morgan, who soon discovers her own agency has been compromised. Forced underground, the pair must rely on little more than Morgan's fierce tenacity and Rees's scientific know-how.Their only path back to safety is to unlock the shocking secrets of the Kafir Project and expose them to the world.But can they beat the impossible odds stacked against them?",340,2016,English,https://i.gr-assets.com/images/S/compressed.photo.goodreads.com/books/1437637595l/25960956._SY475_.jpg,312,4.0,https://www.goodreads.com/book/show/21409704-sanctuary
We Shall Not All Sleep,,['Estep Nagy'],9781632868411,"['Fiction', 'Historical', 'Historical Fiction', 'Adult', 'Literary Fiction', 'Novels', 'Relationships', 'Family', 'Literature', '20th Century']","The entangled pasts of two ruling class New England families come to light over three summer days on an island in Maine in this extraordinary debut novel.1964. The Hillsingers and the Quicks have shared the small Maine island of Seven for generations. Though technically family—Jim Hillsinger and Billy Quick married Park Avenue sisters Lila and Hannah Blackwell—they do not mix. Now, on the anniversary of Hannah’s death, Lila feels grief pulling her toward Billy. Jim, a spy recently ousted from the CIA, decides to carry out the threat Lila explicitly forbid: to banish their youngest son, twelve-year-old Catta, to the neighboring island of Baffin for twenty-four hours in an attempt to make a man out of him.Set during three summer days, Estep Nagy’s debut novel moves among the communities of Seven as longstanding tensions become tactical face-offs where anything is fair game for ammunition. Vividly capturing the rift between the cold warriors of Jim’s generation and the rebellious seekers of Catta’s, We Shall Not All Sleep is a richly told story of American class, family, and manipulation—a compelling portrait of a unique and privileged WASP stronghold on the brink of dissolution.",288,2017,English,https://i.gr-assets.com/images/S/compressed.photo.goodreads.com/books/1481242713l/31450807.jpg,490,3.16,https://www.goodreads.com/book/show/21409704-sanctuary
The Tree with a Thousand Apples,,['Sanchit Gupta'],9789385285516,"['Fiction', 'Historical', 'Historical Fiction', 'Thriller', 'Cultural', 'India', 'Drama', 'Asian Literature', 'Indian Literature', 'Asia']","If the criminal was once a saint and the saint was once a criminal, then who is a criminal and who is a saint?Inspired by true events, this riveting narrative traces the lives of Safeena Malik, Deewan Bhat and Bilal Ahanagar, three childhood friends who grow up in an atmosphere of peace and amity in Srinagar, Kashmir, until the night of 20 January 1990 changes it all.While Deewan is forced to flee from his home, Safeena’s mother becomes ‘collateral damage’ and Bilal has to embrace a wretched life of poverty and fear. The place they called paradise becomes a battleground and their friendship struggles when fate forces them to choose sides against their will.Twenty years later destiny brings them to a crossroads again, when they no longer know what is right and what is wrong. While both compassion and injustice have the power to transform lives, will the three friends now choose to become sinful criminals or pacifist saints?The Tree with a Thousand Apples is a universal story of cultures, belongingness, revenge and atonement. The stylized layered format, fast-paced narration and suspenseful storytelling makes for a powerful, gripping read.",284,2016,English,https://i.gr-assets.com/images/S/compressed.photo.goodreads.com/books/1549089870l/33119297.jpg,456,4.46,https://www.goodreads.com/book/show/21409704-sanctuary
Grave Beginnings,The Grave Report #1,['R.R. Virdi'],9781517790387,"['Fantasy', 'Urban Fantasy', 'Mystery', 'Paranormal', 'Thriller', 'Mystery Thriller', 'Supernatural', 'Dark', 'Crime']","“Quick, clean action, solid character work and pacing. This series is worth your time.” — Jim Butcher, #1 New York Times bestselling author of The Dresden FilesAnother day, another hijacked body. And just 13 hours to solve a murder…Detective Vincent Graves has made a habit of dying. Waking up in someone else’s body isn’t pleasant, especially when it's inside a coffin with tons of dirt pressing down on it. Once he’s out, he learns his soul has 13 hours to find the borrowed body’s killer.With the help of a brilliant FBI agent, Vincent’s quest for clues leads to a looming supernatural presence. And escaping the dark threat may be impossible with his ever-ticking clock…Can Vincent close the case in time, or will a powerful being make him rest in peace for good?Grave Beginnings is the first book in The Grave Report urban fantasy detective series. If you like paranormal twists, hard-boiled investigators, and noir-style magic, then you’ll love R.R. Virdi’s paranormal investigator series.",312,2013,English,https://i.gr-assets.com/images/S/compressed.photo.goodreads.com/books/1448218410l/27815237.jpg,"1,424",4.4,https://www.goodreads.com/book/show/21409704-sanctuary
23:27,,['H.L. Roberts'],0999781405,"['Contemporary', 'Young Adult']","Fame. Money. Glory.These were all the things that you would expect from being famous. The bait that the producers of the industry would tempt you with to get you on their side.What they don't tell you though are all the inner tragedies that come along just as quickly. They don't tell you about the heartache that occurs when you realize that this wasn't what you wanted at all.They don't tell you about the pressure that's always on the verge of crushing you when you're forced to do everything that the public demands for and not what you truly desire.They don't tell you about the self-hatred that would soon take over your entire being at the thought that you will never be good enough.No - they don't tell you these things at all.But, Lilith Rose will.When Lilith Rose, lead singer to one of the most famous rock bands around gets tired of all the lies and secrets that comes with being famous.She decides that it's time for all of it to stop and ends up revealing everything on a Facebook live stream.The result...""Part of me wants to die tonight, part of me wants it to be an accident,and part of me wants someone to notice and save me."" - Lilith Rose.",284,2017,English,https://i.gr-assets.com/images/S/compressed.photo.goodreads.com/books/1494048423l/34826332._SY475_.jpg,108,3.94,https://www.goodreads.com/book/show/21409704-sanctuary
Equations of a Being: A being who gathered moss,,['Ashutosh Gupta'],9781947697034,['Poetry'],"If you have a penchant for both reason and abstractness, this intriguing piece of literature shouldn't be missed. Equations of a Being beautifully coalesces the author's thought pieces pertaining to the existential spectrum. Never has there been a book that blended emotions, intellect, and imagination so seamlessly, to celebrate a being in totality.The author depicts his artistic persuasion, the enriched and disintegrated fragments of his existence, and the conclusions based on his interactions with the physical and abstract elements of life in a compelling and unbridled manner.It's a book for the ages that will let you trace the complete trajectory of a being and realize that a being has been and will always be a convergence of his tryst with abstractness, his acceptance of vulnerability, and his surge for virtuosity.",170,2017,English,https://i.gr-assets.com/images/S/compressed.photo.goodreads.com/books/1502814627l/36012441._SY475_.jpg,43,3.98,https://www.goodreads.com/book/show/21409704-sanctuary
,None,None,,[],None,None,2017,,,,,https://www.goodreads.com/book/show/21409704-sanctuary
Mars Base 1: A new discovery!,,['Bruce   Walker'],,[],"John T Lazarus and his expedition team have been abandoned on Mars. Their crew members gave them up for dead after seeing the cliff they were standing on collapse. The Captain and his team now stand on Mars as they watch their only hope blast off into space.With a brutal windstorm starting, they seek the shelter inside the rock formation to which they fell. With oxygen supplies low and no food or water, the situation is less than hopeless. As they approach the rock formation the dim sunlight glistens on a rock that shoots out to the side, it looks like glass or a diamond. Of all places to find a diamond John thinks.As John reaches for and touches the diamond a slight shaking of the ground starts, then an opening appears in the rock wall like a cave. John enters, as he does lights suddenly illuminate the interior. This is not a cave he thinks, Its a room, He motions for his crew to come in. After the last crew member enters, the door closes. He hears a WHOOSH sound, Then welcome Captain John T Lazarus, a friendly voice states. Atmospheric conditions have been restored Captain; you may remove your breathing apparatus.John asks, Who or what are you? I am Sigma control 9, Autonomous base control. The Captain calls over his science engineer, Claire he asks, can you confirm? Claire replies after looking at her handheld monitor, Captain, 78% nitrogen 21% oxygen Perfect breathable, the temperature is 74. Pressure is 29.25 Millibars, its safe!",0,2018,English,https://i.gr-assets.com/images/S/compressed.photo.goodreads.com/books/1522289929l/39674665._SY475_.jpg,7,4.71,https://www.goodreads.com/book/show/21409704-sanctuary
"Letters From The Universe: The Framework of Everything and a Cosmic Guidance to Love, Life and Beyond",,['Geo Douglas'],0964624206,"['Science', 'Self Help']","Observe, listen, and go with the flow of energy…Letters from the Universepresents a new, simplistic framework for this vast expanse we exist in. By understanding the cosmos and knowing how everything began, we can emulate the ways of the universe and orchestrate a beautiful symphony of life, love and happiness.You will learn:• How we are connected to the universe• What we are made of and how we are connected to each other• How love plays a role in the universe• How to tap into the frequency of the universe and its built-in intelligence• How we apply that connection to our lives• What awaits us in the afterlife.The Cosmos explained with simplicity…The author and his team of astrophysicists and cosmologists present a new theory / framework of the universe. We as a people can learn to explore space in a whole new way, allowing us to break free from the confines of our own solar system.• Insight on a time prior to the Big Bang• How new universes are born• How every galaxy was created• How black holes are formed• How we can travel faster than the speed of light• Wormhole predicted outside earth's atmosphere on a specific day in 2018The Universe will guide you...If you observe, listen, and go with the flow of energy, you will discover a cosmic connection and embark on a love affair with both nature and an inner-awareness that will resonate with purity and beauty. Your journey will soon take a turn and open your life to new opportunities you never thought possible.It’s time to stop resisting these prevailing forces and to start having the courage, strength, and knowledge to ride that wave of good energy for the rest of your days on planet Earth—and beyond into the afterlife.The universe is speaking. It's time to listen.",37,2017,,https://i.gr-assets.com/images/S/compressed.photo.goodreads.com/books/1515165535l/37833118._SX318_.jpg,57,4.47,https://www.goodreads.com/book/show/21409704-sanctuary
Her Beauty,,['M.R. Desmond'],,[],"Two pie loving police officers are questioning a man suspected of murdering his wife. The Accused Man keeps having visions of past events, warning him there are things he should not seek an answer for. And an FBI Agent Lutricia Bell, conducting an investigation of her own, revealing a different angle on the nature of the crime. Realities will mash together as three different viewpoints paint the picture, creating a question, is the crime itself what truly matters?",30,2018,,https://i.gr-assets.com/images/S/compressed.photo.goodreads.com/books/1536268340l/41728325._SY475_.jpg,0,0.0,https://www.goodreads.com/book/show/21409704-sanctuary
Lights on the Sea,,"['Miquel Reina', 'Catherine E. Nelson']",9781503903203,"['Fiction', 'Fantasy', 'Magical Realism', 'Adventure', 'European Literature', 'Spanish Literature', 'Contemporary', 'Family', 'Cultural', 'Spain', 'Adult', 'Drama']","""Miquel Reina's Lights on the Sea is an absolutely lovely, beautiful novel with a dreamy, fable-like quality. Fans of Life of Pi will love this novel."" – Kristin Hannah, NYT bestseller author of ""The Nightingale""In this riveting debut, prize-winning artist and filmmaker Miquel Reina maps out ambitious and fantastical new territory in a novel about a couple holding on for dear life as their world takes an extraordinary fall…On the highest point of an island, in a house clinging to the edge of a cliff, live Mary Rose and Harold Grapes, a retired couple still mourning the death of their son thirty-five years before. Weighed down by decades of grief and memories, the Grapeses have never moved past the tragedy. Then, on the eve of eviction from the most beautiful and dangerously unstable perch in the area, they’re uprooted by a violent storm. The disbelieving Grapeses and their home take a free-fall slide into the whitecapped sea and float away.As the past that once moored them recedes and disappears, Mary Rose and Harold are delivered from decades of sorrow by the ebb and flow of the waves. Ahead of them, a light shimmers on the horizon, guiding them toward a revelatory and cathartic new engagement with life, and all its wonder.Wildly imaginative, deeply poignant, and entirely unexpected,Lights on the Seasweeps readers away on a journey of fate, acceptance, redemption, and survival against the most rewarding of odds.""Miquel Reina's Lights on the Sea is an absolutely lovely, beautiful novel with a dreamy, fable-like quality that will appeal to readers. Fans of Life of Pi will love this novel.""– Kristin Hannah, NYT bestseller author of ""The Nightingale""""An enjoyable, finely written fantasy tale.""– Kirkus Reviews“This beautiful, unusual tale explores the healing power of love and the magic that exists in our everyday lives, even when we don’t know how to find it.”– Jill Santopolo, NYT bestseller author of ""The Light We Lost""",272,2018,English,https://i.gr-assets.com/images/S/compressed.photo.goodreads.com/books/1531330819l/40785049._SY475_.jpg,"2,255",3.98,https://www.goodreads.com/book/show/21409704-sanctuary
Tales of the Astonishing Black Spark,,"['Charlie J. Eskew', 'Charles J. Eskew']",9781941360163,"['Science Fiction', 'Contemporary', 'Fiction', 'Fantasy', 'Sequential Art', 'Graphic Novels', 'Comics', 'Superheroes', 'Speculative Fiction']","Trapped in a dead-end job in his Ohio hometown, watching the girl of his dreams move on to a glamorous new life in a big city—Donald McDougal’s aimlessness has held him back for a long time. When a lightning strike grants him superhuman powers, he jumps at his chance to finally be somebody. But the new abilities and the pursuit of superheroic fame come with a price tag, and it may not be one he can afford.This wry debut is at once a fanboy’s homage to the history of superhero storytelling in America and a keen-eyed satire of those same stories, raising questions about race and privilege that are becoming impossible to ignore.",380,2018,English,https://i.gr-assets.com/images/S/compressed.photo.goodreads.com/books/1532008723l/40028529.jpg,85,4.04,https://www.goodreads.com/book/show/21409704-sanctuary
Di undici foglie,,['Dino Olivieri'],9781791710361,[],"Di Undici Foglie è la prima “ekpyrotic novel” scritta, illustrata e impaginata da Dino Olivieri.Questo romanzo non convenzionale racconta una storia che ripropone in chiave moderna archetipi immortali, illustrata con imago serigrafici, rigorosamente in bianco e nero, ispirati ai maestri illustratori vissuti a cavallo tra la metà dell’800 e i primi anni del 900.Luce e Siri, un giovane uomo e una giovane donna, si incontrano in un universo morente. Le loro vite si scontrano intrecciandosi, come in Natura le materie affini si attraggono unendosi. Miti e leggende si destano da un lungo torpore. Canti dimenticati riportano alle memorie segrete profezie. Audaci potenze cosmiche risorgono e combattono. Due visioni della vita e della morte duellano all’ultimo sangue per compiere i loro supremi epiloghi avversi.Tre Giorni. Tre Lai. Versi ed echi di poemi perduti. Canti in lingue di incerta memoria. Trentatré serigrafie misteriose, storie nella storia, mappe cifrate di mondi ed anfratti oscuri. Imago accompagnati da trentatré Arcani, parti di un Oracolo Occulto, primo Arcrypticon dell’Autore, ultima sfida al Lettore più capace e curioso.Dino Olivieri narra e illustra un universo in uno scrigno, una storia d’amore eterno, una nuova leggenda senza tempo, una visione, un sogno ricevuto all'ombra di un albero eccelso ornato di fronde “Di Undici Foglie”.Dino Olivieri nasce a Torino nel 1969. Informatico, grafico, musicista e scrittore, esordisce nel 2015 pubblicando il romanzo “Di Undici Foglie”. Seguendo le orme dei Maestri Preraffaelliti, stampa in proprio una pregiata ed esclusiva Edizione Zero qui rielaborata in Prima Edizione per il grande pubblico.",304,2015,Italian,https://i.gr-assets.com/images/S/compressed.photo.goodreads.com/books/1545895348l/29345928._SY475_.jpg,43,4.0,https://www.goodreads.com/book/show/21409704-sanctuary
